url,name,address,city,state,phone
https://www.hrblock.com/tax-office-near-me/south-carolina/richburg/28932/?otppartnerid=9308&campaignid=pw_mcm_9308_9762&utm_medium=local,Results,"ÓÉą813 Elliott Rd, Richburg, SC 29729",Richburg,SC,Óāį(803) 203-6995
http://www.rbtaxsc.com/,Results,"ÓÉą1107 Chesterfield Ave, Lancaster, SC 29720",Lancaster,SC,Óāį(803) 285-2540
https://pittersaccountingpros.com/,Results,"ÓÉą454 Anderson Rd S Ste 162, Rock Hill, SC 29730",Rock Hill,SC,Óāį(803) 510-7219
http://www.martinsoncartercpas.com/,Results,"ÓÉą238 Oakland Ave, Rock Hill, SC 29730",Rock Hill,SC,Óāį(803) 328-6241
http://www.bayerscpa.com/,Results,"ÓÉą122 S Confederate Ave, Rock Hill, SC 29730",Rock Hill,SC,Óāį(803) 327-1306
https://axionstrategicadvisors.com/,Results,"ÓÉą252 Rockmont Dr, Fort Mill, SC 29708",Fort Mill,SC,Óāį(803) 768-1839
https://gmslawyers.com/,Results,"ÓÉą224 N Main St, Richburg, SC 29729",Richburg,SC,Óāį(803) 385-2114
https://andersoncpa4u.com/,"Anderson Certified Public Accountant, PC","ÓÉą1040 State Rd S-13-106, Pageland, SC 29728",Pageland,SC,Óāį(980) 269-8350
https://www.facebook.com/KimseyCPA,Greg C. Kimsey CPA,"ÓÉą1808 2nd Baxter Crossing #200, Fort Mill, SC 29708",Fort Mill,SC,Óāį(803) 548-2499
https://www.capstoneaag.com/,Capstone Accounting and Advisory Group - Fort Mill,"ÓÉą1808 2nd Baxter Crossing #200, Fort Mill, SC 29708",Fort Mill,SC,Óāį(803) 548-2499
https://sjordancpa.com/,Susan C Jordan CPA PA,"ÓÉą701 Lancaster Bypass E, Lancaster, SC 29720",Lancaster,SC,Óāį(803) 286-5984
